{
  "schemaVersion": 2,
  "producerId": "worker-broker-live-receipt-runner",
  "producerVersion": 2,
  "manifestDigest": "179f210223b5bc963fa94295217fa7ed9710c5f7620ac6e2eb4883f28b943b73",
  "authorityMode": "synthetic-direct-mcp",
  "phase": "1",
  "pluginVersion": "0.3.0-dev.1",
  "headCommit": "ae1b74f9577da3dcb02a22fb88116469fcb7d6cb",
  "headTree": "7ff92d7caa4b191cf4998848498ee9f1f7d1a60d",
  "sourceInventoryDigest": "4594959432f60520a33f7103dcd17300cd9cef88409fc46a8f7accb9d62e117b",
  "phaseScopeDigest": "3805c3497b3814b58b3def09b0ba6084042b53f908f5b0458bc8e949c59c8cc4",
  "repositoryBeforeDigest": "4594959432f60520a33f7103dcd17300cd9cef88409fc46a8f7accb9d62e117b",
  "repositoryAfterDigest": "4594959432f60520a33f7103dcd17300cd9cef88409fc46a8f7accb9d62e117b",
  "sourcePluginInventoryDigest": "68266497ba3648cfbb4407056679beeff3f1a9d7c3e3b84d13c4977bf5dda7a1",
  "installedPluginInventoryDigest": "68266497ba3648cfbb4407056679beeff3f1a9d7c3e3b84d13c4977bf5dda7a1",
  "installedFileCount": 91,
  "installedEntrypointDigest": "0af3baebef576e7fc5f00d3b0ba007b695c47da6f89dfca310fcd02a1021e815",
  "providerCapabilityDigest": "567514e4762b9988ba930dded86592f0594ced536ff4b0f0fd24462dd4acaee6",
  "observedProviderCapabilities": [
    "root-read-spawn-v1",
    "same-session-read-followup-v1",
    "ordered-turn-boundary-mailbox-v1"
  ],
  "observedToolIds": [
    "worker_list_owned",
    "worker_get",
    "worker_events_after",
    "worker_wait",
    "worker_result",
    "worker_spawn",
    "worker_decide_host_action",
    "worker_followup",
    "worker_send",
    "worker_cancel"
  ],
  "providerBinaryDigest": "e1fafdfffe14f339460befaf194360e8f90bfd02efe8a4f24cfa1c7aea657ffe",
  "providerVersion": "0.2.111",
  "providerRevision": "binary-sha256-e1fafdfffe14f339460befaf194360e8f90bfd02efe8a4f24cfa1c7aea657ffe",
  "mcpProtocolVersion": "2025-11-25",
  "codexBinaryDigest": null,
  "codexVersion": null,
  "codexModel": null,
  "hostTaskDigest": null,
  "installationMethod": "codex-local-plugin-cache",
  "scenarios": [
    {
      "id": "authenticated-completion",
      "spawnInvocationCount": 1,
      "spawnReplayCount": 0,
      "providerLaunchCount": 1,
      "providerTerminalCount": 1,
      "workerTerminalCount": 1,
      "resultReadCount": 1,
      "reconnectCount": 0,
      "cancelInvocationCount": 0,
      "cancelReplayCount": 0,
      "uniqueCancelRequestCount": 0,
      "cancellationEventCount": 0,
      "duplicateLaunchCount": 0,
      "mailbox": {
        "providerGenerationCount": 1,
        "providerSessionCount": 1,
        "promptCount": 3,
        "sendInvocationCount": 3,
        "sendReplayCount": 1,
        "acceptedCount": 2,
        "deliveredCount": 2,
        "deliveryUnknownCount": 0,
        "rejectedCount": 0,
        "finalReportSequence": 2,
        "replayPromptDelta": 0,
        "retainedBodyCount": 0,
        "closed": true
      },
      "workerHostVerification": "not_run",
      "processGroupGone": true,
      "taskRuntimeCleaned": true,
      "runnerTemporaryArtifactsRemoved": true,
      "qualificationSessionDeleted": true
    },
    {
      "id": "mcp-restart-reconnect-cancellation",
      "spawnInvocationCount": 2,
      "spawnReplayCount": 1,
      "providerLaunchCount": 1,
      "providerTerminalCount": 1,
      "workerTerminalCount": 1,
      "resultReadCount": 1,
      "reconnectCount": 1,
      "cancelInvocationCount": 2,
      "cancelReplayCount": 1,
      "uniqueCancelRequestCount": 1,
      "cancellationEventCount": 1,
      "duplicateLaunchCount": 0,
      "mailbox": null,
      "workerHostVerification": "not_run",
      "processGroupGone": true,
      "taskRuntimeCleaned": true,
      "runnerTemporaryArtifactsRemoved": true,
      "qualificationSessionDeleted": true
    }
  ],
  "outcome": "pass",
  "startedAt": "2026-07-24T14:29:20.902Z",
  "endedAt": "2026-07-24T14:30:31.196Z",
  "receiptDigest": "30206a25ee084d09ff4360aa16f2063dae1bfd9694b69995c552dd62818f6133"
}
