{
  "schemaVersion": 2,
  "producerId": "worker-broker-live-receipt-runner",
  "producerVersion": 2,
  "manifestDigest": "179f210223b5bc963fa94295217fa7ed9710c5f7620ac6e2eb4883f28b943b73",
  "authorityMode": "synthetic-direct-mcp",
  "phase": "1",
  "pluginVersion": "0.3.0-dev.1",
  "headCommit": "61f806241e00791b518def19dc23c823d20d5884",
  "headTree": "81b9b099f7f13d2c158ff1966a90f0709b0da690",
  "sourceInventoryDigest": "c668e322d59c9d488a7ab0f413ba1e125dd79f76acb381003ef10e9b14fc2fb6",
  "phaseScopeDigest": "dff6996b7a3b43fd3fc76ee4d2af29ae1680e65061432b552fd63f6976cc2ace",
  "repositoryBeforeDigest": "c668e322d59c9d488a7ab0f413ba1e125dd79f76acb381003ef10e9b14fc2fb6",
  "repositoryAfterDigest": "c668e322d59c9d488a7ab0f413ba1e125dd79f76acb381003ef10e9b14fc2fb6",
  "sourcePluginInventoryDigest": "b4e0b6a63cf41aa4ff4725c45d68ce661b17da7344c7eca8b81212e96e409846",
  "installedPluginInventoryDigest": "b4e0b6a63cf41aa4ff4725c45d68ce661b17da7344c7eca8b81212e96e409846",
  "installedFileCount": 98,
  "installedEntrypointDigest": "0af3baebef576e7fc5f00d3b0ba007b695c47da6f89dfca310fcd02a1021e815",
  "providerCapabilityDigest": "d41f7a7dc58db3b7b9790f1cf0c41957e25aee1584ee5b7fa82535cd07d3e394",
  "observedProviderCapabilities": [
    "root-read-spawn-v1",
    "same-session-read-followup-v1",
    "ordered-turn-boundary-mailbox-v1"
  ],
  "observedToolIds": [
    "worker_list_owned",
    "worker_get",
    "worker_events_after",
    "worker_wait",
    "worker_result",
    "worker_spawn",
    "worker_decide_host_action",
    "worker_followup",
    "worker_send",
    "worker_cancel"
  ],
  "providerBinaryDigest": "5cf05fe670b1818561daf7566b580a5de6b81149166499d61072e49640b541a4",
  "providerVersion": "0.2.112",
  "providerRevision": "binary-sha256-5cf05fe670b1818561daf7566b580a5de6b81149166499d61072e49640b541a4",
  "mcpProtocolVersion": "2025-11-25",
  "codexBinaryDigest": null,
  "codexVersion": null,
  "codexModel": null,
  "hostTaskDigest": null,
  "installationMethod": "codex-local-plugin-cache",
  "scenarios": [
    {
      "id": "authenticated-completion",
      "spawnInvocationCount": 1,
      "spawnReplayCount": 0,
      "providerLaunchCount": 1,
      "providerTerminalCount": 1,
      "workerTerminalCount": 1,
      "resultReadCount": 1,
      "reconnectCount": 0,
      "cancelInvocationCount": 0,
      "cancelReplayCount": 0,
      "uniqueCancelRequestCount": 0,
      "cancellationEventCount": 0,
      "duplicateLaunchCount": 0,
      "mailbox": {
        "providerGenerationCount": 1,
        "providerSessionCount": 1,
        "promptCount": 3,
        "sendInvocationCount": 3,
        "sendReplayCount": 1,
        "acceptedCount": 2,
        "deliveredCount": 2,
        "deliveryUnknownCount": 0,
        "rejectedCount": 0,
        "finalReportSequence": 2,
        "replayPromptDelta": 0,
        "retainedBodyCount": 0,
        "closed": true
      },
      "workerHostVerification": "not_run",
      "processGroupGone": true,
      "taskRuntimeCleaned": true,
      "runnerTemporaryArtifactsRemoved": true,
      "qualificationSessionDeleted": true
    },
    {
      "id": "mcp-restart-reconnect-cancellation",
      "spawnInvocationCount": 2,
      "spawnReplayCount": 1,
      "providerLaunchCount": 1,
      "providerTerminalCount": 1,
      "workerTerminalCount": 1,
      "resultReadCount": 1,
      "reconnectCount": 1,
      "cancelInvocationCount": 2,
      "cancelReplayCount": 1,
      "uniqueCancelRequestCount": 1,
      "cancellationEventCount": 1,
      "duplicateLaunchCount": 0,
      "mailbox": null,
      "workerHostVerification": "not_run",
      "processGroupGone": true,
      "taskRuntimeCleaned": true,
      "runnerTemporaryArtifactsRemoved": true,
      "qualificationSessionDeleted": true
    }
  ],
  "outcome": "pass",
  "startedAt": "2026-07-26T07:11:29.687Z",
  "endedAt": "2026-07-26T07:12:48.203Z",
  "receiptDigest": "b18fd98df8dbb0b712b81c9e37f577db31bae1bf9e37b19339b4c9de64d6a165"
}
